{
  "schemaVersion": "phase4.1a-review-decision-v1",
  "queueVersion": "phase4.1a-unesco-identity-v1",
  "queueFingerprint": "cd0e05a782479b02372cd0ae75da58d3d53b54a667b0d3e7218c4ce621948b9e",
  "exportedAt": "2026-08-26T17:17:00.090Z",
  "decisionCounts": {
    "APPROVE": 1,
    "EDIT": 1,
    "NEEDS_RESEARCH": 1,
    "REJECT": 1,
    "DEFER": 1,
    "total": 62,
    "unreviewed": 57
  },
  "decisions": [
    {
      "queueVersion": "phase4.1a-unesco-identity-v1",
      "proposalType": "IDENTITY_MATCH",
      "source": "unesco",
      "externalId": "4",
      "targetArcheomapsId": "site-0083",
      "decision": "APPROVE",
      "selectedArcheomapsId": null,
      "editedValues": null,
      "curatorNote": "",
      "reviewedAt": "2026-08-26T17:17:00.089Z",
      "evidenceVersion": "phase4.0",
      "proposalFingerprint": "7d46c53ab03ec4f3d7125d736b4406cff471a4918678604424f7c7e1fb2af556",
      "blacklistExactProposal": false,
      "proposalId": "IDENTITY_MATCH::unesco::4"
    },
    {
      "queueVersion": "phase4.1a-unesco-identity-v1",
      "proposalType": "IDENTITY_MATCH",
      "source": "unesco",
      "externalId": "45",
      "targetArcheomapsId": "site-0661",
      "decision": "EDIT",
      "selectedArcheomapsId": "site-0001",
      "editedValues": null,
      "curatorNote": "Manual review: candidate 2 is correct.",
      "reviewedAt": "2026-08-26T17:17:00.090Z",
      "evidenceVersion": "phase4.0",
      "proposalFingerprint": "58594e5f37027644d1a26b74b2ac67aa257599afccab9f05a503af2a8e5a5594",
      "blacklistExactProposal": false,
      "proposalId": "IDENTITY_MATCH::unesco::45"
    },
    {
      "queueVersion": "phase4.1a-unesco-identity-v1",
      "proposalType": "IDENTITY_MATCH",
      "source": "unesco",
      "externalId": "75",
      "targetArcheomapsId": "site-0324",
      "decision": "NEEDS_RESEARCH",
      "selectedArcheomapsId": null,
      "editedValues": null,
      "curatorNote": "",
      "reviewedAt": "2026-08-26T17:17:00.090Z",
      "evidenceVersion": "phase4.0",
      "proposalFingerprint": "6542e707984a20063fd8fb54670213b28fcf88bf196c2fa0b815c79a71312467",
      "blacklistExactProposal": false,
      "proposalId": "IDENTITY_MATCH::unesco::75",
      "needsResearchReason": "coordinates-unclear"
    },
    {
      "queueVersion": "phase4.1a-unesco-identity-v1",
      "proposalType": "IDENTITY_MATCH",
      "source": "unesco",
      "externalId": "79",
      "targetArcheomapsId": "site-0059",
      "decision": "REJECT",
      "selectedArcheomapsId": null,
      "editedValues": null,
      "curatorNote": "Different site.",
      "reviewedAt": "2026-08-26T17:17:00.090Z",
      "evidenceVersion": "phase4.0",
      "proposalFingerprint": "a593f842516355e2702abcdf65391f856c15246ab79f7d67fd959e5c2836cfbc",
      "blacklistExactProposal": false,
      "proposalId": "IDENTITY_MATCH::unesco::79",
      "rejectReason": "name-coincidence"
    },
    {
      "queueVersion": "phase4.1a-unesco-identity-v1",
      "proposalType": "IDENTITY_MATCH",
      "source": "unesco",
      "externalId": "80",
      "targetArcheomapsId": "site-0067",
      "decision": "DEFER",
      "selectedArcheomapsId": null,
      "editedValues": null,
      "curatorNote": "",
      "reviewedAt": "2026-08-26T17:17:00.090Z",
      "evidenceVersion": "phase4.0",
      "proposalFingerprint": "b79cc87828b58380c671456bd900722272ee3b6ff98b68f33f6442991c2132f8",
      "blacklistExactProposal": false,
      "proposalId": "IDENTITY_MATCH::unesco::80"
    }
  ],
  "unreviewedProposalIds": [
    "IDENTITY_MATCH::unesco::113",
    "IDENTITY_MATCH::unesco::119",
    "IDENTITY_MATCH::unesco::129",
    "IDENTITY_MATCH::unesco::144",
    "IDENTITY_MATCH::unesco::149",
    "IDENTITY_MATCH::unesco::150",
    "IDENTITY_MATCH::unesco::184",
    "IDENTITY_MATCH::unesco::193",
    "IDENTITY_MATCH::unesco::240",
    "IDENTITY_MATCH::unesco::243",
    "IDENTITY_MATCH::unesco::244",
    "IDENTITY_MATCH::unesco::295",
    "IDENTITY_MATCH::unesco::310",
    "IDENTITY_MATCH::unesco::326",
    "IDENTITY_MATCH::unesco::357",
    "IDENTITY_MATCH::unesco::364",
    "IDENTITY_MATCH::unesco::366",
    "IDENTITY_MATCH::unesco::369",
    "IDENTITY_MATCH::unesco::373",
    "IDENTITY_MATCH::unesco::411",
    "IDENTITY_MATCH::unesco::414",
    "IDENTITY_MATCH::unesco::481",
    "IDENTITY_MATCH::unesco::483",
    "IDENTITY_MATCH::unesco::485",
    "IDENTITY_MATCH::unesco::530",
    "IDENTITY_MATCH::unesco::567",
    "IDENTITY_MATCH::unesco::569",
    "IDENTITY_MATCH::unesco::592",
    "IDENTITY_MATCH::unesco::611",
    "IDENTITY_MATCH::unesco::613",
    "IDENTITY_MATCH::unesco::631",
    "IDENTITY_MATCH::unesco::642",
    "IDENTITY_MATCH::unesco::675",
    "IDENTITY_MATCH::unesco::779",
    "IDENTITY_MATCH::unesco::791",
    "IDENTITY_MATCH::unesco::800",
    "IDENTITY_MATCH::unesco::833",
    "IDENTITY_MATCH::unesco::886",
    "IDENTITY_MATCH::unesco::936",
    "IDENTITY_MATCH::unesco::939",
    "IDENTITY_MATCH::unesco::941",
    "IDENTITY_MATCH::unesco::942",
    "IDENTITY_MATCH::unesco::1018",
    "IDENTITY_MATCH::unesco::1040",
    "IDENTITY_MATCH::unesco::1042",
    "IDENTITY_MATCH::unesco::1224",
    "IDENTITY_MATCH::unesco::1226",
    "IDENTITY_MATCH::unesco::1435",
    "IDENTITY_MATCH::unesco::1455",
    "IDENTITY_MATCH::unesco::1457",
    "IDENTITY_MATCH::unesco::1502",
    "IDENTITY_MATCH::unesco::1503",
    "IDENTITY_MATCH::unesco::1572",
    "IDENTITY_MATCH::unesco::1595",
    "IDENTITY_MATCH::unesco::1645",
    "IDENTITY_MATCH::unesco::1714",
    "IDENTITY_MATCH::unesco::1731"
  ]
}